"Kò síbi tó dàbí ilé, tìlù-tìfọn ni wọ́n fi kí Anthony Joshua tó bẹ ìlú rẹ̀, Ṣágámù wò káàbọ̀"," Oríṣun àwòrán, CockFM Radio Ṣe awọn agba bọ wọn ni ọmọ ale ni fi ọwọ osi juwe ile baba rẹ. Gbajugbaja akanṣẹ lagbaye, Anthony Joshua bẹ ile wo lọjọru. Taara ta ilu rẹ ni Ṣagamu lo mori le, nibẹ lo si ti ṣe baba kẹẹ pẹ sawọn ọbalaye ati oriade gbogbo to wa nilu naa. Eyi ni igba akọkọ ti Anthony Joshua yoo maa yọju si orilẹede Naijiria lẹyin to gba igbanu ẹyẹ agbaye rẹ, WBA, WBO, IBF ati IBO pada lọwọ Andy Ruiz. Ọmọ orilẹede Mexico naa si lo gba ami ẹyẹ ọhun dani fun bi oṣu diẹ, nibi ija wọn to waye ni gbagede Diriyah Arena lorilẹede Saudi Arabia. Oríṣun àwòrán, CockFM Radio Ọkẹ aimoye awọn ololufẹ rẹ ni wọn rọgba yii ka lasiko to fi lọ ki Alafin Ẹlẹpẹ ati Akarigbo ti ilẹ Rẹmọ ni aafin wọn. Lẹyin to foribalẹ fawọn ọba alade naa tan, ni Anthony Joshua wa ya fọto pẹlu awọn ololufẹ rẹ ti wọn wa foju gaanni rẹ. Oríṣun àwòrán, CockFM Radio Ariwo 'ibi ni ile rẹ kii ṣe ilẹ Gẹẹsi' ni ọpọlọpọ awọn eeyan to tu sita wa wo agba ọjẹ akanṣẹ naa n pa, bi gbogbo wọn ṣe n da giiri lati baa ya fọto, ti wọn si tun wọ tọọ lẹyin lati aafin Elepe lọ si aafin Kabiyesi Akarigbo ti ilu Rẹmọ.",20 Èrèlè 2020
"Barmasai ọmọ Kenya ṣe ipò kínní nínú eré ìje-gígùn ìlú Eko, ipò wo ni Sanwo-Olu gbà?"," Oríṣun àwòrán, Twitter/Lagos State Govt. Ọmọ orilẹede Kenya, David Barmasai lo gba ami ẹyẹ ipo kinni ninu ere eje-gigun ti ilu Eko ti ọdun 2020. Barmasai pari ere to le ni kilomita mejilelogoji laarin wakati meji ati iṣẹju mẹwaa. Ẹbun owo to le ni miliọnu mejidinlogun naira ni Barmasai yoo mu re 'le fun ipo kinni to gba ninu ere ọhun. Ọna ara ọtọ ni Barmasai ọmọ ilẹ Kenya gba jawe olubori ninu ere eje-gigun ọhun. Ẹwẹ, Gomina Babajide Sanwo-Olu naa wa lara awọn to kopa ninu ere eje-gigun naa to waye niluu Eko lọjọ Abamẹta, ọjọ kẹjọ oṣu keji ọdun 2020. Ninu isọri tawọn obinrin, Sharon Cherop ti oun naa jẹ ọmọ bibi ilẹ Kenya lo jawe olubori. Iye owo kan naa ni ọkunrin ọkunrin ati obinrin to jawe olubori ninu ere eje-gigun naa jọ gba. Eyi ni igba karun un ti ere eje-gigun yii yoo waye niluu Eko lẹyin ti alakọkọ iru rẹ waye lọdun 2016.",8 Èrèlè 2020
"Odion Ighalo darapọ mọ́ ikọ̀ Manchester United, òjijì ló bá àwọn olólùfẹ́ rẹ̀"," Oríṣun àwòrán, Getty Images Ẹgbẹ agbabọọlu Manchester United ti fi ọrọ lede pe Odion Ighalo ti darapọ mọ ikọ ọhun. Eyii to tumọ si pe Ighalo ni ọmọ Naijiria akọkọ ti yoo gba bọọlu fun ikọ Manchester United. Ẹlẹsẹ ayo naa ni ikọ Man United n yalo lati ikọ rẹ tẹlẹ, Shanghai Greenland Shenhua to wa lorilẹ-ede China. Akẹgbẹ rẹ tẹlẹ ninu ikọ Supper Eagles, Mikel Obi ni ọmọ Naijiria akọkọ ti yoo tọwọ bọwe adehun pẹlu ikọ Man United, ṣugbọn ko gba bọọlu fun ikọ ọhun. Igahlo to ti jẹ olofẹ ikọ Manchester United tẹlẹ ni awọn adari ikọ naa lero pe yoo kopa ribiribi ninu awọn idije saa yii to n lọ lọwọ. Ṣaaju ni Igahlo ti n kopa ninu igbaradi pẹlu ikọ Shenshua fun saa tuntun, ṣugbọn saa naa ni idaduro nitori arun Corona to bẹ silẹ lorilẹ-ede China. Gẹgẹ bi iroyin ti Sky Sports fi lede, ikọ Tottenham naa ti gbiynaju lati fa ọmọ ọgbọn ọdun ọhun mọra, ṣugbọn o kuna. Ighalo bẹrẹ si ni di gbajumọ nidi iṣẹ bọọlu nigba to wa ni ẹgbẹ agbabọọlu Julius Berger ni Naijiria, ko to lọ si ikọ Udinese lorilẹ-ede Italy. Ki Ighalo to kuro ni ikọ Supper Eagles, oun ni ẹni to gba bọọlu to pọju sinu awọn ninu idije AFCON to waye lọdun 2019 pẹlu bọọlu meje. Nigeria's Under-19:Ẹ wo bí Ikọ̀ Cricket Naijiria ṣe mi àgbáyé titi Ọpọlọpọ awọn ololufẹ Ighalo lo ya lẹnu pe ""Red Devils"" buwọlu igbesẹ Ighalo yii pẹlu bi Man U ṣe jẹ ọkan lara awọn ẹgbẹ agbabọọlu to gbajumọ gan lorilẹede Naijiria. Kete ti wn gbọ ni wn fọn sori ayelujara lati da si ọr naa.",1 Èrèlè 2020
Akànṣẹ́ àti alákòso Aṣẹ́wó, Ikọ ọtẹlẹmuyẹ Africa Eye tun de orilẹede Congo nibi to ti finmu finlẹ nipa igbe aye awọn ọdọbinrin ti wọn dagba soju popo. Fidio naa ree: Africa Eye: Ìrírí àwọn ọ̀dọ́bìnrin tó dágbà sójú pópó àti ìrètí wọn fún ọjọ́ ọ̀la,29 Sẹ́rẹ́ 2020
Akànṣẹ́ àti alákòso Aṣẹ́wó, Ikọ ọtẹlẹmuyẹ Africa Eye tun de orilẹede Congo nibi to ti finmu finlẹ nipa igbe aye awọn ọdọbinrin ti wọn dagba soju popo.,29 Sẹ́rẹ́ 2020
Ife ẹ̀yẹ kẹrìnlélógùn d'ète fún Serena Williams," Oríṣun àwòrán, Getty Images Ọrọ Serena Williams, agbabọọlu ẹlẹyin ori papa ati ilepa rẹ lati gba ife ẹyẹ idije lawn tennis Grandslam fun igba kẹrinlelogun tun ti dete. Wang Qiang, ọmọ orilẹede China lo bomi pana ala yii lẹẹkan sii nibi idije Australian Open to n lọ lọwọ. Serena Williams jẹ ọkan lara awọn odu elere idaraya Lawn Tennis ti itan agbaye ko lee gbagbe laye lẹyin awọn bẹbẹ loriṣiriṣi to ti gbe ṣe lere idaraya naa. Kí lo tíì rí  nípa Amotekun? Ẹ sùnmọ́bí, ẹ wo gbankọgbì! Ẹ̀yin obìnrin tẹ́ẹ fẹ́ wá bímọ ní America, ọ̀nà ti tì pa látònì! - Trump Amọṣa, lẹyin to gba idije Australian open ni ọdun 2017, eyi to mu ki iye ife ẹyẹ grandslam to ti gba o jẹ mẹtalelogun lo ti n lepa ati gba ẹyọkan sii ko lee jẹ mẹrinlelogun ti yoo si sọ  ọ di elere idaraya Lawn tennis to da gba ami ẹyẹ Lawn tennis to pọ julọ ninu itan lagbaye. Amọṣa, lati igba yii wa ni o ti n ba ijakulẹ pade. Lẹni ọdun mejidinlogoji, ireti ọpọ nigba ti idije Australian open ti ọdun 2020 bẹrẹ ni pe ilakaka Serena Williams yoo so eso rere ki o to di pe o pade Wang Qiang ọmọ orilẹede China ni ipele kẹta idije naa. Wang gbo ewuro soju Serena eleyi to jẹ ipele to ya ju ti Serena ti jabọ ni idije Lawn Tennis lati ọdun mẹrinla sẹyin ti o ti ja kulẹ ni ipele yii kan naa nigba to koju Daniela Hantuchova. Williams ti kọkọ fẹyin Wang gbolẹ ni idije US open ni osu kẹsan ọdun to kọja ki Wang to wa gba ẹsan rẹ bayii",24 Sẹ́rẹ́ 2020
"Láì rọ lápa rọ lẹ́sẹ̀, ẹ wo ọmọ ọdún mọ́kànlá tó ń lọ́ ara lóríṣi ọ̀nà"," Ọmọde ni ara rẹ rọ to yii. Ọmọ ọdun mọkanla ni Fopefoluwa Ayo-Oyalowo to tete mọ iru ẹbun ti Ọlọrun fun un to si n mu u lo lati majesin. Latigba to ti wa ni ọmọ ọdun marun lo ti mọ pe oun ni ẹbun naa. ""Bí mo bá ti jí, tí mo pàrọ̀ aṣọ, máà gbé orin sí i, iṣẹ́ lílọ ara bẹ̀rẹ̀ nìyẹn"". Ọmọ to n ko ọmọ alainile kuro lori titi Ọmọdé mẹ́tàdínlọ́gbọ̀n gbòmìnira nílé ayédèrú ọmọ òrukàn tíjọba tì pa 'Ọjọ́ mẹ́fà lọ́sẹ̀ ni mo fi ń gbáradì láti tayọ àwọn ẹlẹgbẹ́ mi táá jọ ń wẹ odò' 'Àwón òbí míì n fi ọmọ wọn ṣe òwò ní Naijiria’ Fayemi fojú Alufa to fipa bá ọmọde lòpọ̀ síta l'Ekiti Fopefoluwa ni nigba ti oun lọ wo ori ayelujara fun fọnran awọn to ti di gbajugbaja ninu iru ohun to yan laayo yii, o pinu lọkan ara rẹ pe oun le ṣe ohun ti wọn n ṣe daadaa. O ni ""Soffie Dossie, gbajugbaja to n lọ ara ni awokọṣe mi"". Lori awọn obi to maa n pa ina ẹbun amutọrunwa mọ awọn ọmọ wọn lara, Fopefoluwa sọ ọrọ iṣiti fun wọ.",23 Sẹ́rẹ́ 2020
Ẹ wo bí Ikọ̀ Cricket Naijiria ṣé mí àgbáyé titi,  Ikọ agbabọọlu ere alafigigba ta mọ si Cricket lọrilẹede Naijiria ti ni o da bi ala loju awọn pẹlu bi awọn ṣe pegede lati kopa ninu idije Ife Agbaye Cricket fun igba akọkọ. Lorileede South Africa ni idije  fawọn ọjẹwẹwẹ ti ọjọ ori wọn ko ju ọdun mọkandilogun lọ naa ti o ti gbera sọ lọjọ kọkanlelogun oṣu kini  ti n waye. Balogun Ikọ naa lasiko to n ba BBC sọrọ ni idunnu ati ayọ lọ jẹ fun awọn pe awọn ṣe aṣeyọri  latyi kopa ninu idije naa bi o tilẹ je pe awọn eniyan ko fi taratara gba ti ere idaraya ọhun. Naijiria yoo ma a koju ikọ Australia ninu ipele akọkọ fun idije agbaye naa.  Peter Aho to ṣẹṣẹ pe ẹni ọdun mẹrindinlogun lo gba bọọlu wọnu awọn ti wọn fi bori ifẹsẹwọnsẹ ti wọn fi jawe olubori patapata. Awọn ọmọ ikọ Agbabọọlu Cricket Naijiria ni awọn sa ipa awọn ki awọn le jẹ iwuri  fun ikọ ojẹwẹwẹ to n bọ lọna. Wọn fi kun pe awọn ni igbagbọ pe awọn eniyan yoo bẹrẹ si ni fẹran  lati ma a wo ẹrẹ bọọlu Cricket naa  bi wọn ti ṣẹ fẹran ẹrẹ bọọlu afẹsẹgba.,21 Sẹ́rẹ́ 2020
Ọ̀pọ̀ èrò ló máa ń bẹ̀ mí pé kí ń má lọ pa ara mi- Ọmọtọshọ, Ọpọ igba ni mo ti ṣubu sẹyin- Omotosho Samson Samson Omotosho ti ọpọ maa n pe ni Super Touch Roller Blader ṣalaye fun BBC pe iṣubu oun maa n kọ oun lẹkọọ sii nipa ere idaraya ti oun yan laayo ni. Ati tọmọde-tagba ni oun maa n da lẹkọ lori ere idaraya naa ni Naijiria. Samson Ọmọtọṣọ mẹnuba oriṣi ẹka ere idaraya 'Skating' to wa lasiko yii ati awọn igbesẹ inu ṣiṣe wón. Bakan naa lo sọrọ lori bi Baba ati Iya rẹ ṣe gba kamu lori ọrọ naa ti wọn si n pese atilẹyin to yẹ fun oun. Produced by: Joshua Akinyemi,19 Sẹ́rẹ́ 2020
Màá ra Arsenal ní 2021 tí mo bá kọ́ iléeṣẹ́ ìfọ́po rọ̀bì tán - Dangote," Oríṣun àwòrán, Twitter/Arsenal Ọrọ gbajugbaja oniṣowo, Aliko Dangote ati rira ẹgbẹ agbabọọlu Arsenal ti wa di igbin tẹnu mọ igi bayii. Dangote to jẹ ẹni to lọrọ julọ nilẹ Afirika ti n sọ tipẹ pe oun nifẹ lati ra ẹgbẹ agbabọọlu Arsenal. Gẹgẹ bi ololufẹ ikọ Arsenal fun ọjọ pipẹ, Dangote soju abẹ niko loni lori eto kan pe ọdun 2021 loun yoo ra Arsenal bayii. Dangote ni kete ti oun ba ti kọ ile iṣẹ ifọ epo rọbi to tobi julọ lagbaaye ti oun n kọ lọwọ tan loun yoo ra Arsenal lọdun 2021. Nnkan ko fara rọ laarin awọn ololufẹ Arsenal ati alaṣẹ ikọ agbabọọlu naa, Stan Kroenke lọwọlọwọ. Tipẹ tipẹ lawọn ololufẹ Arsenal ti n sọ pe ki Ọgbẹni Kroenke ta ikọ agbabọọlu naa fun ẹlomiiran nitori wọn ko fẹran bi o ṣe n dari rẹ. Ipo kẹwaa ni Arsenal wa lori tabili idije liigi ilẹ Gẹẹsi(Premier League), lẹyin ti Mikel Arteta di akọnimọọgba tuntun lẹyin ti Unai Emery kuro tan. Ẹwẹ, ọpọ awọn ololufẹ Arsenal ni iroyin yii dun mọ, niṣe ni wọn n sọ loju opo ayelujara Twitter pe ki Dangote tete wa ra ẹgbẹ agbabọọlu naa.",13 Sẹ́rẹ́ 2020
Serena Williams gba ife ẹ̀yẹ àkọ́kọ́ láàrin ọdún mẹ́ta sẹ́yìn," Oríṣun àwòrán, Getty Images Serena Williams na Jessica Pegula ni Auckland pẹlu 6-3; 6-4 Ife ẹyẹ akọkọ ni yii ti Serena Williams maa gba laarin ọdun mẹta. O na Jessica Pegula ninu idije to waye ni Auckland pẹlu ami ayo Mẹfa si mẹta ati mẹfa si mẹrin. Lati ọdun 2017 ti Serena Williams ti bi ọmọbinrin rẹ Alexis Olympia ni o ṣẹṣẹ gba ife ẹyẹ rẹ akọkọ. Eyi ni ife ẹyẹ nla miran to tun gba lẹyin Grand Slam to gba ni Rome ni 2016 ati Australian Open to gba ni 2017 ko too bimọ. Lẹyin idije yii ni oun ati ọrẹ rẹ Caroline Wozniacki ajọ dije ẹlẹni meji nibi ti wọn ti le jawe olubori ninu idije Auckland Tennis Center. Trump picture: ọjọ́ tí Trump kí mi kú iṣẹ́ lórí 'twitter' ní inú mi dùn jù- Oyedele Awọn mejeeji a koju Asia Muhammed ati Taylor Townsend ninu idije naa lọjọ Aiku. Oju Serena Williams to jẹ ẹni ọdun mejidinlogoji naa wa lara gbigba ife ẹyẹ Margaret Court 24 ti Australia to jẹ Grand Slam ẹlẹni kan ṣoṣo. Eduardo: Mo ń jí mọ́tò pẹ̀lú àwọn ọ̀rẹ́ mi nítorí pé mo fẹ́ di 'Big boy'",12 Sẹ́rẹ́ 2020
"Akẹgbẹ́ mi méjì kú, ọ̀pọ̀ farapa lọ́wọ́ agbébọn, orí ló yọ mi - Adebayor"," Oríṣun àwòrán, Getty Images Ọjọ buruku eṣu gbomi mu, oni ọjọ kẹjọ oṣu kinni ọdun 2020 lo pe ọdun mẹwaa tawọn agbebọn kan kọlu awọn agbabọọlu ilẹ Afirika lorilẹede Angola. Awọn ti ori ko yọ ninu iṣẹlẹ naa, ninu eyi tawọn kan ti di ero ọrun, ṣe iranti bi iṣẹlẹ ọhun ti ṣẹlẹ lapa ẹkun Cabinda lorilẹede Angola. Akọroyin BBC, Matthew Kenyon naa ṣe iranti bi ikọlu naa ṣe mu ẹmi awọn agbabọọlu orilẹede Togo meji lọ. Kenyon ni lẹyin tawọn agbebọn kọlu ọkọ tawọn ẹgbẹ agbabọọlu Togo wa ninu rẹ, loun ṣe ifọrọwanilẹnuwo pẹlu agbẹnusọ ikọ naa, tii ṣe Emmanuel Adebayor, to n ṣoju ikọ agbabọọlu Manchester City nigba naa. O ṣalaye pe, ti ibẹru-bojo ni Adebayor fi n sọ ohun to sẹlẹ ṣawọn agbabọọlu Togo, koda Adebayor sọ ninu ifọrọwanilẹnuwo naa pe, ẹru ṣi n ba oun lẹyin tawọn akẹgbẹ rẹ meji ṣagbako iku ninu ikọlu naa. Oríṣun àwòrán, Other Junior Senaya to jẹ ọkan lara awọn agbabọọlu fikun ọrọ Adebayor pe, ninu ọkọ lawọn wa tawọn n gbọ orin, ṣadeedee lawọn bẹrẹ si ni gbọ iro ibọn ninu igbo. ''Ka to wi, ka to fọ, wọn yinbọn pawọn akẹgbẹ wa ti a jọ wa ninu ọkọ, nibi ti gbogbo wa ti mọ pe ewu n bẹ loko longẹ niyẹn,'' Senaya lo woye bẹẹ. Kodjovi Obilale, to jẹ aṣọle nigba naa kan ṣadeedee ri pe oun ti fara gbọta, loju ẹsẹ lo rii pe ẹjẹ bẹrẹ si ni da lati ikun ati ẹsẹ oun mejeeji. Obiulale ni lẹsẹkẹsẹ loun bẹrẹ si ni ke pe ''ẹ gbami, ẹ gbami, ọta ibọn ti ba mi, mo fẹ ri ọmọbinrin ati ọmọkunrin mi, mi o fẹ ku sibi.'' Igbakeji akọnimọọgba fẹgbẹ agbabọọlu Togo, Amelete Abalo naa figbe ta pe ọta ibọn ba oun, Amelete pada ku lẹyin ti ọta ibọn ba a tan. Adebayor ranti pe, fun bi ọgbọn iṣẹju lawọn janduku naa fi n dabọn bo ọkọ tawọn wa ninu rẹ, lai le kuro loju kan naa. Adebayor ni iṣẹlẹ naa jẹ ọkan lara awọn manigbagbe iṣẹlẹ to buru ju to ṣẹlẹ s'oun laye.",8 Sẹ́rẹ́ 2020
Siasia bẹ̀bẹ̀ ìrànwọ́ N100m lọ́wọ́ ọmọ Nàìjíríà láti ṣejọ́ jìbìtì tí FIFA fi kàn án," Oríṣun àwòrán, Twitter/Samson Siasia Ẹ rànmí ìrànwọ́ pẹ̀lú N100m láti ṣejọ́ jìbìtì tí FIFA fi kàn mi Akọnimọọgba ẹgbẹ agbabọọlu Naijiria, Super Eagles, Samson Siasia ti bẹ bẹ iranwo to to ọgọrun un miliọnu naira lati fi ṣe ẹjọ lori ẹsun riba ti ajọ FIFA fi kan an. Loṣu kẹwaa, ọdun 2019 ni ajọ FIFA fẹsun kan Siasia pe o gba lati tẹwọ gba riba lati ṣe eeru ninu awọn ifẹsẹwọnsẹ kan to ti waye sẹyin. Siasia ni oun ti gbiyanju agbara oun lati wa owo ti yoo fi ṣe ẹjọ naa nile ẹjọ to n ri si awuyewuye to ba jẹyọ nibi ere bọọlu afẹsẹgba lagbaaye. Ṣugbọn awọ ko tii ka oju ilu nitori ọgọrun un miliọnu kii ṣe owo ọmọde owo. Siasia tun ti wa kepe ijọba apapọ atawọn ẹlẹyinju aanu ọmọ Naijiria pe ki wọn ran oun lọwọ pẹlu owo ki oun le yọ orukọ oun ninu ẹsun jibiti ti wọn fi kan oun. Ajọ FIFA fofin de Siasia pe ko gbọdọ ni ohun kankan ṣe mọ pẹlu ere bọọlu, amọ o ni oun ko mọwọ, bẹẹ ni oun ko mẹsẹ lori ọrọ naa. Trump picture: ọjọ́ tí Trump kí mi kú iṣẹ́ lórí 'twitter' ní inú mi dùn jù- Oyedele Siasia to wa lara awọn agbabọọlu Naijiria to gba ife ẹyẹ ilẹ Afirika lọdun 1994 lorilẹ-ede Tunisia, sọ pe lori ayelujara loun naa ti gbọ ẹsun ti ajọ FIFA fi kan oun gẹgẹ bi ọpọ ọmọ Naijiria naa ṣe rii. LASU Ritual: Àwọn akẹẹgbẹ́ akẹ́kọ̀ọ́ LASU tí wọn fi ṣowó sọ̀rọ̀ lórí ìgbé ayé olóògbé Siasia ni: Mo kan ṣadeedee gba ipe lati ọdọ ọwọ aarẹ ajọ NFF to n dari ere bọọlu ni Naijiria ninu eyi to ti bi mi leere boya mo ti ri lẹta lati ọdọ FIFA, Oríṣun àwòrán, Twitter/Samson Siasia O ni lẹyin naa loun ri lẹta ọhun ninu ẹrọ agbọrọkaye oun ṣugbọn Siasia sọ pe oun ko mọ nnkankan lori ẹsun ti wọn fi kan oun. Yatọ si pe ajọ FIFA fofin de Siasia, ajọ naa tun ni ko san owo itanran bi miliọnu mejidinlogun naira. Igbẹjọ naa yoo waye lọjọ kọkandinlogun oṣu kẹta ọdun yii niluu Lausanne, lorilẹede Switzerland. Dambe fight: ìdíje ìjà láàrin àwọn akóni tó n ja ẹ̀ṣẹ̀",8 Sẹ́rẹ́ 2020
C. Ronaldo fi góòlù mẹ́ta bẹ̀rẹ̀ ọdún 2020," Oríṣun àwòrán, Getty Images Ogbontagi agbabọọlu ọmọ orilẹede Portugal, Christiano Ronaldo ti fi goolu mẹta ṣẹwọ ninu ọdun tuntun. Ronaldo tun rọjo goolu gẹgẹ bi iṣe rẹ pẹlu goolu mẹta nibi ifẹsẹwọnsẹ ẹgbẹ agbabọọlu Juventus pẹlu Cagliari ni liigi Serie A. Igba akọkọ niyi ti Ronaldo yoo gba goolu mẹta wọle ni ifẹsẹwọnsẹ kan naa lati igba to ti dara pọ mọ Juventus lọdun 2018. Oun ni agbabọọlu akọkọ ti yoo gba goolu mẹta wọle ninu ifẹsẹwọnsẹ kan ṣoṣo ni liigi mẹta ọtọọtọ lagbaye, iyẹn liigi ilẹ Gẹẹsi (Premier league), liigi orilẹede Spain (la liga) ati liigi ilẹ Aguda, orilẹede Italy (Serie A). oun yii kan naa si tun ni agbabọọlu to gba goolu mẹta wọle ninu ifẹsẹwọnsẹ kan naa julọ lagbaye. ifẹsẹwọnsẹ mẹrindinlọgọta ọtọtọ ni Ronaldo ti gba goolu mẹta wọle, eleyii ti ko si agbabọọlu miran to tii dan iru bẹbẹ bẹ wo. Oríṣun àwòrán, Getty Images Kii ṣe tuntun mọ pe ifigagbaga wa laarin Ronaldo ati Messi toun pẹlu jẹ odu agbabọọlu lagbaye. Ni kete ti ifẹsẹwọnsẹ naa pari si ni awọn ololufẹ awọn mejeeji ti n waako lori ikanni ayelujara gbogbo. Bi awọn ti Ronaldo ko ṣe fẹ wọn ọn kun, lawọn ti Messi naa ko fẹ gba a laabọ.",6 Sẹ́rẹ́ 2020
Van Persie gbàgà lẹ́nu rẹ! Solskjaer fárígá lẹ́yìn tí Van Persie ló ń rẹ́rìn-ín," Oríṣun àwòrán, Other Bi oju akata ba lewo, ẹnu adiẹ kọ la o ti gbọ. Bayii ni akọnimọọgba Manchester United, Ole Gunnar Solskjaer ṣe fesi si ọrọ ti ẹleṣẹ ayo tẹlẹ ri fun ẹgbẹ agbabọọlu Arsenal ati Man U, Robin van Persie. Van Persie lo bu ẹnu atẹ lu bi Solskjaer ṣe n rẹrin lasiko ti o n dahun ibeere awọn akọroyin lẹyin ti Arsenal ṣina iya fun Man U tan. Van Persie kii ṣe asiko ti ẹgbẹ agbabọọlu Man U ṣẹṣẹ fidi rẹmi tan lo yẹ ki Ole maa rẹrin nigba to n dahun ibeere awọn akoroyin. Amọ ọrọ yii ko bọ si ibi to dara lara Ole, nisẹ lo tutọ soke to si fi oju gba a. ''Mi o mọ Van Persie ri, oun naa ko si mọ mi, nitorinaa Van Persie ko lẹtọọ lati ma tako ọna ti mo n gba dari ikọ Man U,'' Solskjaer lo sọ bẹẹ. Solskjaer tun tẹsiwaju, o ni ''Van Persie gba aṣo igbabọọlu oun to ni nọmba ''20'', ohun kan to maa ri gba lọwọ mi niyẹn.'' Ọrọ yii ti di iṣu ata yan-an yan-an loju opo Twitter nibi ti ọpọ ti bẹrẹ si ni fi Ole ati Van Persie we ara wọn nigba ti wọn gba bọọlu fun ikọ Man U. Awọn ni Van Persie dantọ ju Ole lọ nigba to fi ṣoju ẹgbẹ agbabọọlu Man bo tilẹ jẹ pe akoko to lo ko to ti Ole. Ọbẹ Ẹgusi sise ati jijẹ #Queen Dihya: Obinrin tó gbógun tàwọn agbésùnmọ̀mí ni Algeria Amọ, awọn mii fi aake kọri, wọn ni Ole kii ṣẹgbẹ Van Persie ni gbogbo ọna pẹlu ohun nla to gbe ṣe nigba to wa ni Man U. 2020: Ọdun 2020 yii ko nìí nira fún àwọn tó bá bẹ̀rù Olorun",4 Sẹ́rẹ́ 2020
