BBC kéde àwọn tó pegedé láti gba àmì ẹ̀yẹ èrè ìdárayá ọdún 2021," Ileeṣẹ iroyin BBC ti kede orukọ awọn eeyan to fa kalẹ fun ami ẹye ẹni to pegede julọ ninu ere idaraya lọdun  2021. Igbimọ awọn akọroyin lati ilẹ Afrika ati ilẹ Gẹẹsi lo ṣe akojọpọ orukọ awọn eeyan mẹfa naa. Wọn yan awọn eeyan ọhun gẹgẹ bii aṣeyọri wọn ninu awọn ifẹsẹwọnsẹ ti wọn ti kopa kaakiri agbaye laarin oṣu Kiini si oṣu Kẹsan an, ọdun 2021. Bakan naa ni wọn tun yan awọn eeyan naa lori awọn aṣeyọri wọn yatọ si ipa ti wọn n ko ninu ere idaraya. Awọn eeyan naa ree: Oríṣun àwòrán, Getty Images Orilẹ-ede: Kenya Ọjọ ori: 37 Ere: Ere-ije gigun Eliud Kipchoge di gbajumọ lẹyin to jawe olubori ninu ere ije oni maili mẹrindinlogun ninu idije Olympic. Lẹyin naa ni igbimọ Olympic naa kede orukọ rẹ gẹgẹ bii okunrin to tayọ julọ ninu idijẹ ọhun. Okunrin ọhun jawe olubori ninu idije mẹtala ninu marundinlogun to ti kopa ninu rẹ. Lẹni ọdun mẹrindinlogoji, Eliud Kipchoge ni okunrin to dagba julọ ti yoo bori ninu ere-ije gigun ninu idije Olympic lẹyin Calos Lopes, lati Portugal lọdun 1984. Oríṣun àwòrán, Getty Images Orilẹ-ede: Kenya Ọjọ ori: 27 Ere: Ere-ije gigun Faith Kipyegon bori ninu ere 1,500 mita lẹyin to ti kọkọ bori ninu ere ije naa ni Rio de Janeiro lọdun 2016. Lẹyin to bori tan lo fi aṣeyọri naa sọ ori ọmọ rẹ obinrin to jẹ ọmọ ọdun mẹta, eyii to ni oun lo fun oun ni iwuri lati ṣe aṣeyọri. Bo ṣe fi ami ẹyẹ naa sọri ọmọ rẹ ṣe pataki nitori oun ni elere ije kẹta ti yoo bi ọmọ, ti yoo si tun jawe olubori ninu idije lẹyin to bimọ tan. Awọn meji akọkọ ni Shirley Strickland latri Australia ati Francoise Mbango lati Cameroon. Oríṣun àwòrán, Getty Images Orilẹ-ede: Kenya Ọjọ ori: 27 Ere: Ere-ije 200m Ntando Mahlangu jawe olubori ninu ere idaraya awọn akandan ẹda fun igba akọkọ lasiko to wa ni ọmọ ọdun mẹrinla lọdun 2016. Lọdun yii, o tun jawe olubori ninu ifẹwọnsẹ long jump ninu idije Olympic ni Tokyo. Igba to wa ni ọmọ ọdun mẹwaa ni wọn ge ẹsẹ rẹ mejeji nitori ẹsẹ naa kọ lati dagbe bi awọn ẹya ara rẹ to ku ṣe n dagba. Oríṣun àwòrán, Getty Images Orilẹ-ede: Namibia Ọjọ ori: 18 Ere: Ere-ije  Igba to wa lẹni ọdun marundinlogun lo kọkọ gba goolu fun orilẹ-ede rẹ ninu idije Tokyo Olympic 2020. Oríṣun àwòrán, Getty Images Orilẹ-ede: Senegal Ọjọ ori: 29 Ere: Adele bọọlu alafẹsẹgba Edouard Mendy ti ṣe bẹbẹ lati igba to ti darapọ mọ ẹgbẹ agbabọọlu Chelsea lati Rennes. Orukọ rẹ wọ inu iwe itan gẹgẹ bii adele ẹgbẹ agbabọọlu akọkọ lati ilẹ Afrika ti yoo kopa ninu idije Champions League. Oríṣun àwòrán, Getty Images Orilẹ-ede: South Africa Ọjọ ori: 24 Ere: Breaststroke Tatjana Schoenmaker ni obinrinn akọkọ ti yoo gba ife ẹyẹ Olympic fun South Africa lati ọdun 2000. Nigba to  ba awọn akọroyin sọrọ lẹyin to gba ami ẹyẹ naa tan, o ni afojusun oun lọwọ yii ni ki oun bẹrẹ si n ṣe daadaa ju ti tẹlẹ lọ.",6 Ọ̀pẹ̀̀ 2021
"Ṣé lóòtọ́ ní pé ìlúmọ̀ọ́ká agbábọ́ọ̀lù ayé àtijọ́ Teslim Thunder Balogun gbá ṣọ́ọ̀tì gbígbóná fi pa ""Goal keeper""?"," ""Ó wù ẹ̀, kò wù ẹ́, tí wọ́n bá ti gbọ́ pé ọmọ bíbí Thunder Balogun ni ẹ́, dandan ni wàá gbá bọ́ọ̀lù fún School ẹ"". Ajibola Hakeem Balogun ọmọ gbajugbaja ati ilumọọka agbabọọlu fun orilẹede Naijiria ni ọpọlọpọ ọdun sẹyin nigba ti aye ṣi wa lorokun, Teslim Balogun gba BBC Yoruba lalejo. Teslim Balogun ti ọpọlọpọ mọ kaakiri agbaye si Thunder Balogun kẹnu bọ ọrọ lori iyatọ to wa laarin igbe aye baba rẹ gẹgẹ bi irawọ agbabọọlu aye atijọ ati bi awọn ti aye ode oni ṣe n ṣe. O ni lati kekere ni awọn ọmọ Thunder Balogun ti n gbadun iyi to wa ninu orukọ ati iṣẹ ti baba awọn nṣe. Bi ileewe kan ba ti fẹ gba wọn fun ẹkọ lati kekere gẹgẹ bo ṣe sọ, “bi wọn ba ti rii pe ọmọ Thunder Balogun ni ẹ, yala o wu ẹ tabi ko wu ẹ o, oo niṣẹ meji, wọn a ni koo niṣo lori ọdan na, afi dandan koo gba bọọlu fun ileewe yẹn”. “Orúkọ bàbá mi Thunder Balogun máa ń dẹ́rù ba àwọn ikọ̀ agbábọ́ọ̀lù tí àwa ọmọ rẹ̀ bá kojú”. O ni awọn imọran ti Baba oun Teslim Balogun maa n fun awọn tayọ gbigbe orukọ rẹ ti gbogbo agbaye n wari fun lọ. ""Taa ba ni ka lọ si ọja lọ ra nkan lasiko ti iya mi ba loyun ti emi ati baba mi lọ, àwọn oní-Tomato, aláta, oníṣu á máa kó ọjà wọn lọ́fẹ̀ẹ́ sínú ọkọ̀ bàbá mi"". O ni iyi ti baba oun ati awọn tawọn jẹ ọmọ maa n ri kii ṣe kekere. Agbaọjẹ akọroyin aye atijọ kan, Segun Adenuga ti BBC Yoruba bá sọ̀rọ̀, ṣalaye iru agbabọọlu ti Thunder jẹ lori ọdan. O ni ko si ootọ kankan to jọ pe Thunder Balogun fi ṣọ́ọ̀tì pa aṣọ ojule kankan. Ege lo maa n ge ju koda o fẹẹ le bi aṣọle pe ibo lo fẹ ki oun gba bọọlu wọle si lawọn rẹ sibẹ yoo ṣi tayọ”. “Laye atijọ, tọkan tara ni wọn fi n gba bọọlu, pe wọn mu wọn lasan pe ki wọn wa gba bọọlu fun orilẹede wọn, iyi nla ni, ko si si ẹni to maa n beere owo, tọrọ kọbọ ni wọn maa n fun wọn”. Ọmọ Thunder Balogun ṣe afiwe bi awọn gbajumọ irawọ aye ode oni ṣe maa n takete si awọn ololufẹ wọn tabi le wọn danu ti wọn ba ri wọn lawujọ. “Baba mi maa n sọ nigba taa wa ni kekere pe bọọlu tawọn n gba yii ati bawọn eeyan ṣe fẹran awọn si, kii  ṣe bọọlu ori papa nikan o tori gbogbo awọn taa ba fẹ lọ ra nkan lọja lo ma maa pariwo Thunder Thunder ti wọn a maa yọ mọ mi”. Bakan naa ni ọmọ eekan agbabọọlu gba awọn ọdọ asiko yii to yan bọọlu gbigba gẹgẹ bi iṣẹ layo nimọran. Akoroyin BBC to ṣe ifọrọwanilẹnuwo yi, Adedayo Ehinmitan lo ya aworan naa pẹlu ọpọlọ",3 Ọ̀pẹ̀̀ 2021
"Ó di gbéré, Ole lọ! Manchester United yọ Ole bí ẹni yọ jìgá gẹ́gẹ́ bí akọ́nimọ̀ọ́gbá wọn"," Oríṣun àwòrán, Manchester United Lẹyin ọ rẹyin, ẹgbẹ agbabọọlu Manchester United ti le akọnimọọgba wọn, Ole Gunnar Solskjaer, lọ lẹyin ti Watford lu wọn ni alubami pẹlu ami ayo mẹrin si ẹyọkan ninu idije Premier League. Man U fi ikede yii lede loju opo Facebook rẹ lọjọ Aiku. Ẹgbẹ agbabọọlu naa ni o nira fun awọn lati le Ole danu amọ, awọn ni lati ṣe bẹẹ nitori nkan ko ṣẹnu 're fun Man U mọ. Michael Carrick ni yoo maa ṣe akoso Man United bayii titi ti wọn yoo fi yan akọnimọọgba fidihẹ.",21 Bélú 2021
"Liverpool faṣọ iyì ya mọ́ Man U lára, ó wọ Ole àti Ronaldo láṣọ ẹ̀tẹ́"," Oríṣun àwòrán, Getty Images Liverpool ṣe ẹgbẹ agbaboolu Manchester United risa-risa ninu Ifẹsẹwọnsẹ idije Premier League to waye ni papa isere Old Trafford lọjọ Aiku. Àmì ayo marun ùn sodo ni Liverpool gba si awọn Man U nile wọn eleyii ti United ko sí lee ta putu. Ẹlẹsẹ ayo n ni, Mohammed Salah lo gbayo mẹta ọtẹtọ wọlé fun Liverpool ninu ere bọọlu ọhún. Naby Keita lo kökọ ṣide ayo nigba ti o gba góòlù akọkọ s'awọn Man United. Diogo Jota lo fi ọba lee fun Liverpool ni Old Trafford. Lẹyin naa ni agbaojẹ Salah gba góòlù mẹta lera s'awọn",24 Ọ̀wàrà 2021
Bimbo Oshin ṣàlàyé ọ̀rọ̀ ìkẹyìn tí ọkọ rẹ̀ sọ fun un kó tó kú," Mo ti sun ẹkun ti mi o sun laarin ọdun marindinlọgbọn mi gẹgẹ bi oṣere tiata, sibẹ, bi ala lo ṣi ri loju mi. Pẹlu omije loju ni mo n kọ ọrọ ikẹdun yii. Eyi ni ọrọ ti gbajumọ oṣere, Bimbọ Ọshin fi bẹrẹ ọrs idagbere to ka nibi isinku ọkọ rẹ, oloogbe Ibironkẹ ti gbogbo eeyan mọ si Dudu Heritage. ""Mo ni anfani nla ti ko lẹlẹgbẹ lati jẹ iyawo fun ọkunrin to bẹru Ọlọrun to si tun nifẹ ati alaafia julọ ti obinrin kobinrin lee fi tọrọ. Ko si bi aye mi ṣe tun lee ladun laisi rẹ."" Ifẹ aye mi ni to ṣe ohun gbogbo to yẹ lati daabo bo mi lainaani oniruuru ikoju ati ariwisi. Oun ni eeyan kan ṣoṣo to mọ ohun ti a n pe ni ifẹ. Mo dupẹ pe mo lanfani lati baa rin irinajo ala rere to ni, ireti, ifẹ, ibanidọrẹ to yii ka."" Bimbọ Ọshin ni bi oun ba ti n ranti ọjọ kejila oṣu kẹsan ọdun 2021, inu oun kii dun. O ni ọrọ to sọ kẹyin fun oun naa ni pe nigba ti oun fẹ lọ gbe ọmọ awọn ni ibudo iṣire Golf course ṣi n wa si iranti lọkan oun. ""Mo ṣi pe ẹ ni nnkan bii agogo meje ku iṣẹju diẹ lalẹ ọjọ naa nigba ti mo wa gbe ọmọ wa ni Golf Club gẹgẹ bi o ṣe sọ fun mi pe ki n ṣe. Ọkan mi ọ fun mi pe ki n pe ẹ lati yọju si mi ni ita nibi ti wọn n gbe ọkọ si. Mo pe ẹ o si ṣe nlẹ o iyawo ẹ, maa binu, mo wa ni ipade kan."" Ọrọ ajọsọ wọn to gbẹyin niyi. O ni ọmọbinrin wọn a maa beere lọwọ oun pe nibo ni baba awọn wa ṣugbọn esi ti oun maa n fun un ni pe Baba rẹ ti ls darapọ ms awọn angẹli. Gbajumọ oṣere naa ṣe apejuwe ọkọ rẹ Dudu Heritage gẹgẹ bi ọkunrin to ni itẹlọrun ati oruks rere nitori o gbagbọ pe orukọ rere san ju wura ati Fadaka. O ni Ọkọ to fun oun iyawo rẹ atawọn ọmọ ni ifọkanbalẹ ni. Ẹrin rẹ a si maa ran ka gbogbo ile. Eto isinkun gbajugbaja oniṣowo, to tun jẹ ọkọ gbajumọ oṣere tiata Yoruba, Bimbo Oshin, iyẹn Ola Ibiropnke ti ọpọ eeyan mọ si Dudu Heritage ti waye nilu Ibadan. Ori papa ti wọn ti n gba ẹyin orilẹ ilẹ pẹlu igi sinu iho, Ibadan Golf Club ni eto naa ti kọkọ bẹrẹ. Wọn bẹrẹ eto ọhun pẹlu gbingbin igi kan ni gbagede ti wọn ti n gba gọọfu naa lati ṣe iranti rẹ, ati lati ṣe apẹrẹ pe bo tilẹ jẹ pe o ti jade laye, yoo si wa laaye sibẹ. Ọpọ awọn oṣere tiata Yoruba lo peju sibi eto itiju naa. Lara awọn agba oṣere to wa nibẹ ni, Adewale Adeoye, ti ọpọ eeyan mọ mọ si Adewale Elesho ẹnu n ja waya. Elesho sọ fun BBC Yoruba pe Dudu Herigate jẹ ẹnikan to lawọ gidi to si maa n fẹ ki itẹsiwaju ba ẹlomiran. ""Akokoro eyín lè ṣe ìpalára fún àtọ̀ ọkùnrin, ó sì lè yọrí sí ṣàkóbá fún ọkàn èèyàn"" Bakan naa lo ni Dudu Hertiage kii ṣe ẹni to ni ahun, o si maa lawọ lati ṣe ore fun ọpọ eeyan. Ẹwẹ, ọrẹ timọ-timọ si oloogbe ọhun, to tun jẹ mbalogun ẹgbẹ awọn to n gab gọọfu, amofin Idowu Salami sọ fun BBC pe ẹgbẹ awọn to n gba gọọfu naa n ṣedaro oloogbe. O fi kun pe inu ọgba Ibadan Golf Club naa gangan ni Dudu wa nigba ti ọlọjọ de.",15 Ọ̀wàrà 2021
"Buhari gbà mí, wá ṣe onígbọ̀wọ́ ìjà ẹ̀ṣẹ́ kíkàn mi, kó tó bọ́ mọ́ mi lọ́wọ́ - Ridwan Oyekola"," Ridwan Scorpion Oyekola tun ti ba BBC Yoruba sọrọ lori ohun to jẹ ẹdun kan rẹ lọwọ lọwọ bayii, eyi to si le se akoba fun ẹsẹ kikan to yan laayo. Oyekola ni lẹyin osu mẹfa ti oun gba ami ẹyẹ bẹliti agbaye, lo yẹ ki oun tun ija miran ja lati tun bẹliti naa gba. O ni osu kẹfa ọdun 2021 lo yẹ ki ija keji naa ti waye, amọ ko si onigbọwọ fun oun eyi ti ko tii jẹ ki ija naa waye. Akansẹ agbaye naa ni ajọ to n se kokari idije naa ti n yọ oun lẹnu, ti wọn si ti fi ọjọ ija naa si ọgbọnjọ osu Kẹwa taa wa yii. Amọ o ni titi di akoko yii, onigbọwọ kankan ko tii si fun oun lati ja ija naa, to si n ke si aarẹ mMuhammadu Buhari atawọn ọlọrọ lorilẹede yii, lati wa se iranwọ fun lori ika oun. Oyekola ni lai si onigbọwọ, wọn le gba bẹliti agbaye naa lọwọ oun, eyi to le se akoba fun ẹsẹ kikan to yan laayo, ti yoo si da omi tutu si lọkan.",13 Ọ̀wàrà 2021
"""Mo gba àmì ẹ́yẹ wúrà fún Nàíjíríà ní Tokyo 2020 àmọ́ ìgbé ayé mi ń burú si ni"""," Latifat Tijani jẹ akọni to n gbe irin fun orilẹede Naijiria ninu awọn idije fawọn agba ọjẹ elere idaraya lagbaye. Ilu Abeokuta nipinlẹ Ogun ni Latifat ti wa, oun nikan soso si ni elere idaraya to mu ami ẹyẹ goolu wale laarin awn elere idaraya to jẹ akanda ẹda to soju orilẹede wa ninu idije ere idaraya Olympics fawọn akanda ẹda to waye ni Tokyo lọdun 2020. Saaju ni Latifat ti kọkọ gba ami ẹyẹ fadaka fun orilẹede Naijiria lọdun 2016 ti inu awọn alasẹ ilẹ wa si dunnu si awọn igbesẹ akin ti akọni obinrin to jẹ akanda ẹda naa n gbe. Amọ bo ti se bẹbẹ to yii, Latifat ko ri ohun rere kankan tọkasi lati safihan iyi ati ẹyẹ to n mu ba ilẹ baba rẹ. Koda, inu ile ti Latifat n gbe ko wu oju ri rara, eyi to n mu ki ibinu awọn ọmọ Naijiria maa ru soke si ijọba pe se o yẹ ki iya maa jẹ iru eeyan bayii. BBC Yoruba ba Latifat fọrọ jomitoro ọrọ, to si salaye pe ijọba ko tii se amusẹ gbogbo ileri ti wọn se fun oun lati ọdun 2016 titi di akoko yii bi o tilẹ jẹ pe wọn n se ileri pe awọn yoo se e. O ni igbe aye oun lo n fi ojoojumọ buru si lojoojumọ, iwọnba ohun ti oun ri gba lọwọ gomina Amosun lọdun 2016 si ni oun fi sare se ile ti oun n gbe. Amọ sibẹ sibẹ Latifat ni ifẹ nla ti oun ni si ere idaraya ko yinjẹ rara, ti oun si setan lati se bẹbẹ siwaju niwọn igba ti ijọba ba fun ohun lawọn ohun eelo to yẹ fun igbaradi awọn elere idaraya bii ti oun.",12 Ọ̀wàrà 2021
"Ọ̀pẹ́lọpẹ́ Seyi Makinde lára mi, ẹbí tó yẹ kó ràn mí lọ́wọ́ ní mo lówó mi fi mọ ẹbí - Ridwan-Scorpion Abẹ̀ṣẹ́kùbíòjò"," Scorpion ti di gbajugbaja abẹṣẹkubiojo pẹlu ami ẹyẹ kan to tun ṣẹṣẹ gba gẹgẹ bi ajawe olubori agbaye fun International Super Featherwight Champion. Ridwan Oyekola ni orukọ rẹ amọ ọpọlọpọ mọ ọ si ""Scorpion"". O ni ki okiki to de fun oun gan ni awọn eeyan ti n pe oun ni olowo to si jẹ pe oun ko tii jẹ nkankan asan okiki orukọ loun kan ni. O ṣalaye pe ko si ni to n ṣe iru iṣẹ yii ninu idile oun amọ ẹgbin kan ti oun koju lo jẹ ki oun bẹrẹ ẹṣẹ jija tori o pade obinrin kan to fẹ baa ja lai mọ pe ogbontarigi abẹṣẹkubiojo gan ni obinrin hun to si luu bii bara. ""Mo ti gba sọwedowo miliọnu mẹwaa ri to jẹ pe kinkini ninu rẹ lo pada tẹ mi lọwọ"". 'Kàǹkàn ìbílẹ̀, òògùn, àwọ̀tẹ́lẹ̀ àti fóònù lá bá lẹ́gbẹ̀ẹ́ òkú obìnrin tí wọ́n dédé jù sí àdúgbò wa l'Akure' Ṣé o tí gbọ́ nípa eNaira, owó àìrí tuntun tí CBN ṣe ìfilọ́lẹ̀ rẹ̀? Nkan tí ó ní láti mọ̀ rèé Mo sún ìgbẹ́jọ́ yìí láàrin Princess àti Baba Ijesha síwájú di 21/10/2021 torípé ...- Adájọ́ Ayé ò! Báyìí ní ọwọ́ FBI ṣé tún tẹ àwọn gbájúẹ̀ ọmọ Nàìjíríà 11 ní Texas Mọ̀ nípa àìsàn tó ń mú ǹkan ọmọkùnrin lè gìdìgbà láì rọlẹ̀ Ridwan ni ẹbun owo miliọnu mẹwaa ti oun ri gba lọwọ Gomina ipinlẹ Oyo lo gbe oun jade gẹgẹ bi ilumọọka. ""Tori eyi, lai tilẹ tii gba owo, awọn ẹbi ati ọrẹ ti n ro pe mo ti di olowo ti wọn si n sọ pe mo lowo mi o fi ran awọn lọwọ. Mi o ni ọkọ ayọkẹlẹ ara mi ti mo fi n rin koda mi o ni N100,000 ni asuwọn owo mi, ọla Ọlọrun ati Gomina Seyi Makinde nikan ni mo n jẹ"". Ridwan ni ẹ́un ọkọ ti wọn ṣeleri gan ko tii tẹ oun lọwọ koda o ni awọn adigunjale tun da oun lọna tori ikede miliọnu mẹwa naira ti oun jẹ. Sorpion Ridwan kẹnu bọ ọrọ lori bi didi eeyan olokiki ṣe ko ijiya baa. Iṣẹ́ abẹ tí Bola Tinubu ṣe ló fa àbẹ̀wò ọ̀pọ̀ èèyàn sọ́dọ̀ rẹ̀ - Fayemi Sotitobire pe ẹjọ́ kòtẹ́milọ́rùn lórí ẹ̀wọ̀n gbére Kíláàsì wó lé ọmọ ilé ẹkọ́ mẹ́ta lórí, ọ̀kan ti kú, ẹ wo ohun tó ṣe méjì tó kù",28 Owewe 2021
Ẹ̀rù ò b'odò! Mo ṣetán láti dojú ìjà kọ Tyson Fury báyìí- Anthony Joshua," Oríṣun àwòrán, Getty Images Abẹṣẹkubiojo ọmọ Naijiria to fi orilẹede UK ṣe ibuje, Anthony Joshua ti sọ pe oun ti ṣetan lati ba Tyson Fury ja. Bo tilẹ jẹ pe  ọmo ilẹ Ukraine, Oleksandr Usyk ti gba bẹniti rẹ mẹtẹẹta lẹyin to lu u lalubami, AJ ni oun si le ja lai si awọn bẹniti yii. Usyk ya agbado ha sawọn eeyan lẹni lalẹ ọjọ Abamẹta lẹyin to fi ẹṣẹ gbade ori Joshua. Ṣugbọn ohun ti Joshua n sọ bayii ni pe oun kọkọ fẹ gba bẹniti oun pada lọwọ Usyk. O ni lẹyin naa ni oun le rona ati ba Fury ja. Ó bà ni kò bàjẹ́, ẹ wo ọ̀rọ̀ tí Anthony Joshua sọ lẹ́yin tí Usyk fẹ̀ṣẹ̀ gbadé orí rẹ̀ láìròtẹ́lẹ̀ Iku ogun nii pa akinkanju, iku odo nii pa omuwẹ, odo ti a ba foju di nigba mii maa n le gbe ni lọ. Abẹṣẹkubiojo Anthony Joshua ti sọrọ soke lẹyin ti akẹṣẹ jẹun ọmo ilẹ Ukraine, Oleksandr Usyk fẹṣẹ gbade lọwọ rẹ niluu London lalẹ ọjọ Abamẹta. Iyalẹnu lo jẹ fun ọpọlọpọ awọn ololufẹ AJ nigba ti Usyk bẹrẹ si ni rọ ojo ẹṣẹ le e lori ti ko si lee ta putu. Oríṣun àwòrán, Getty Images Gbogbo awọn oludajọ ija lo ni Usyk lo bori AJ pẹlu ayo 117-112, 116-112, 115-113 ni papa iṣere ẹgbẹ agbabọọlu Tottenham niluu London. Ọpọ lo ti ro pe Joshua yoo fi ẹṣẹ dabira si Usyk lara ṣaaju ija wọn, ọrọ bẹyin yọ nigba ti wọn bẹrẹ si ni lewọ sira wọn. Ẹwẹ, Joshua ti fi ọrọ ranṣẹ sawọn ololufẹ rẹ lẹyin to fidi rẹmi tan niluu London. AJ ni o ba ni, ko bajẹ, ''ọmọ akin, maṣe ba ọkan jẹ, koda gbogbo aye le maa wo lulẹ niwaju rẹ. Ẹyin araalu London mo nifẹ yin gan an, ẹ ṣe mo dupẹ gbogbo eeyan, ẹ ku gbogbo igba ti ẹ n gbaruku ti mi.'' 'Eniola Badmus wọ pátá lọ sí ààfin Oba Elegushi, ""ọ̀ín"" kí ló burú níbẹ̀?' Ọmọ ẹgbẹ́ PDP Oyo tí inú bá ń bí, ẹ kó ""mo kó - mo rò"" yín wá ká yanjú ẹ̀ - Makinde Ọkùnrin kan tó jẹ gbèsè N4.6m ni wọ́n so mọ́lẹ̀ bíi ewúrẹ́ Onigbọwọ Joshua naa, Eddie Hearn ti sọ ero rẹ lori bi Joshua ṣe fidi rẹmi ninu ija oun ati Usyk. Hearn ni o ṣeeṣe ki Joshua ti fi oju ṣeṣe tori ko le riran daadaa mọ nigba ti ija naa de ipele kẹsan an. Usyk ti di abẹṣẹkubiojo lagbaaye bayii lẹyin to gba bẹniiti mẹta lọwọ Joshua. Romeo and Juliet padà di ìwé Akinola àti Arike ní èdè Yorùbá",26 Owewe 2021
"Omi lórí pápá ìṣeré Lekan Salami kìí ṣe tuntun, ó lè ṣẹlẹ níbikíbi - Ìjọba Oyo"," Omi lórí pápá ìṣeré Adamasingba kìí ṣe tuntun, ó lè ṣẹlẹ níbi kíbi- Ìjọba OyoSeyi Makinde ṣí pàpá ìṣeré tó fi N5.3bn tún ṣe àmọ́ òjo bàá jẹ́ lọ́jọ́ ayẹyẹ ìṣíde Ijọba ipinlẹ ti fesi lori iroyin to gba ori ayelujara nipa bi omi ṣe dagun si ori papa iṣere Adamasingba ti Gomina Seyi Makinde ipinlẹ Oyo ṣi ni Ọjọ́rú. Nigba ti o n ba BBC Yoruba sọrọ, akọwe iroyin fún Gomina Makinde, Taiwo Adisa sọ pe omi to dagun lori papa iṣere naa kii ṣe ohun ti oju ko riri. Ọgbẹni Adisa ni ""iru nkan bayii naa n ṣẹlẹ ní òkè òkun to fi mọ ninu idije Premier League gan an. Ọpọ ìgbà ni a máa n ri bi yinyin ṣe maa n jabọ, ti o si máa n ṣakoba fun papa iṣere ti wọn ti n gbabọọlu. Oríṣun àwòrán, OYSG Igba miiran gan an, wọn máa wọgile ere bọọlu ti yinyin ba ti pọju lori papa. Bakan naa lo fikun pe iṣẹ atunse papa ere idaraya naa ṣi n lọ lọwọ, ti isẹ ko si tii pari patapata nibẹ. ""Agbaṣẹse to n se atunse papa isere idaraya naa ṣẹṣẹ gbin koriko sori papa ere bọọlu ọhún, ni nkan bi oṣu meji sẹyin. Gomina Makinde si lo pinnu lati ṣi papa iṣere naa ki ẹgbẹ agbabọọlu Shooting Stars le lanfaani lati máa lo o fún igbaradi idije Super 8 wọn ni. Ijebu Ode ni Shooting Stars ti n lọ gbabọọlu lati ọjọ yii wa, eleyii ti ko si bojumu to."" O wa fikun pe o buru jai ki odidi ilu Ibadan, to jẹ olu ìlú ijọba iwọ oorun guusu Naijiria tẹlẹ má ni papa iṣere ti ẹgbẹ agbabọọlu ipinlẹ Oyo le maa lo. Idi niyii, ti ijọba fi tètè ṣi papa iṣere naa nigba ti agbaṣẹṣe ko ti pari iṣẹ lori papa iṣere naa. Seyi Makinde: Ẹ̀yin tẹ́ fẹ́ fi ọ̀rọ̀ ẹ̀sin ba Oyo jẹ́, ẹ ṣọ́ra ṣe Fún àwọn tí wọn n sọ pé ijọba na biliọnu marun o le diẹ naira (N5bn) lori papa iṣere lasan, Taiwo Adisa ni kii ṣe ori papa Adamasingba nikan ni owo wà fún o. ""Ipele mẹta ni iṣẹ lori papa iṣere Adamasingba yìí pin sí, agbaṣẹṣe ṣẹṣẹ n pari iṣẹ lọ lori ipele kinni ni iṣẹ papa iṣere naa ni. Agbaṣẹṣe sọ fún ijọba pe o kere tan, o máa to oṣu mẹta ki ori papa iṣere Adamasingba tó ṣee lo daadaa. Lara N5bn yìí naa ni agbaṣẹṣe yoo ti kọ oríṣìíríṣìí gbọngan ere idaraya pẹlu awọn ohun elo igbalode. Bakan naa, agbaṣẹṣe yóò tún kọ ile itura sí papa iṣere yìí láti lè maa ri owo ṣe àtúnṣe papa iṣere yìí,"" Adisa lo sọ bẹẹ. Amọ agbaṣẹṣe to n ṣiṣẹ atunse papa isere idaraya naa kọ láti bá BBC Yoruba sọrọ nigba ti a kàn sí lati gbọ tẹnu rẹ lori isẹlẹ to waye lana ọhun . Nnkan ayọ ati itura ni wẹliwẹli ojo maa n jẹ lọpọlọpọ igba ti o ba rọ si ori ilẹ fun gbogbo ẹda alaye. Ṣugbọn awuyewuye ni ojo to rọ l'Ọjọru nibi ayẹyẹ atunṣe papa iṣẹre Lekan Salami, to n bẹ ni Adamasingba mu lọwọ. Saaju ni gomina Seyi Makinde ti kede pe biliọnu marun ati miliọnu lọna ọọdunrun naira (N5.3bn) ni oun naa lati se atunse papa isere idaraya naa. Ọwọ eeyan si lo n foju soju sode lati pe wo papa isere awodamiẹnu naa, ti wọn lo ba tawọn ilẹ okeere mu, nigba to ba di sisi. Lara awọn eto ti wọn si la kalẹ fun ayẹyẹ sisi papa isere idaraya naa ni ifẹsẹwọnsẹ ere bọọlu laarin ẹgbẹ agbabọọlu 3SC ati NK Tabor Sezana lati orilẹede Slovenia. Ayẹyẹ iside naa bẹrẹ ni pẹrẹu ni nnkan bi i aago marun un irọlẹ, ohun gbogbo lo si n lọ leto-leto, ko to di wi pe ojo bẹrẹ ni papa iṣere naa. Lati ibẹ si ni ọpọplọpọ awọn eeyan ti o lọ wo iran ifẹsẹwọnsẹ ere bọọlu naa, ti bọ si ori itakun ayelujara lati fi aidun inu wọn han lori awọn kudiẹ-kudiẹ ti wẹliwẹli ojo naa tu sita lasiko ti ifẹsẹwọnsẹ n lọ lọwọ. Lori opo ikansiraẹni Facebook, ẹnikan ti orukọ rẹ n jẹ Morufu Smith kọọ sibẹ pe, ""Mo kọ iwe lati gbe oriyin fun Ṣeyi Makinde lori atunṣe papa iṣere Lekan Salami saaju ọjọ ayẹyẹ naa.  Mo si fi kun ọrọ mi pe laipẹ laijina a o mọ boya ojulowo ni awọn nnkan ti wọn tun se nibẹ. O si ṣẹlẹ bẹẹ lasiko ti ifẹwọnsẹ n lọ lọwọ nitori ọpọlọpọ omi lo rogun si ori papa ti wọn ti n gba bọọlu, nitori ko si ibomii ti agbara ojo le ṣan si. Femi Branch: Gbogbo dúkìá mi àti ti ìyá mi ni mo tà láti tọ́jú ẹsẹ̀ mi fún ọdún méjì Sé sàgbèlójúyòyò ni ‘renovations’ tí Sèyí se ni?"". Ẹlomii to tun fi ọrọ lede, Adebisi Adeniyi ni ""ọta ẹni ki i pa odu ọya"", ti ariwo si sọ lórí omi tó kún pápá ìṣeré Lekan Salami, O fi kun ọrọ rẹ pe awọn ọta ilọsiwaju lo n binu Ṣeyi Makinde nitori ojo to rọ nibi ayẹyẹ naa. Ninu ọrọ ti ẹ, Godwin Onoghokere ni ""Gomina Makinde(Ọyọ) na N5.3BN lati ṣe atunṣe papa iṣere ṣugbọn ojo tuna aṣiri iṣẹ to ni ọwọ oṣelu ninu"". Awọn ọkanọjọkan fọnran lo ti lu ori ayelujara pa, ninu eyii ti awọn eeyan ti n ṣe afihan ibi ti omi ti n jo labẹ orule papa iṣere naa. Ọpọ araalu ti wa n beere pe ta lo jẹbi aṣiṣẹ naa laarin ijọba ipinlẹ Ọyọ ati kọngila ti wọn gbe isẹ naa fun?",2 Owewe 2021
