"₦147m la rí kójọ fún ìwọ́de, a kò fẹ́ owó mọ́, ìwọ́de ti parí - Feminist Coalition"," Ẹgbẹ kan to n lewaju ninu eto akoso iwọde EndSARS ni Nigeria, The Feminist Coalition, ti kede pe oun ti yọwọ yọsẹ kuro ninu iwọde naa. Bakan naa lo kede pe oun ti se alaye lori owo ti wọn ri ko jọ fun iwọde naa, ti apapọ rẹ jẹ miliọnu mẹtadinlaadọjọ naira. Ọjọbọ ni ẹgbẹ Feminist Coalition kede pe oun ko ni ni ohunkohun se pẹlu iwọde kankan mọ. O salaye pe asẹ ti aarẹ Muhammadu Buhari pa ninu ọrọ to ba awọn ọmọ Naijiria sọ, pe ki wọn fi opin si iwọde wọn, lo mu ki oun se ipinnu ọhun. O wa rọ awọn alatilẹyin ẹgbẹ naa nilẹ yii ati loke okun, lati dẹkun fifi owo sọwọ sinu apo asunwọn ẹgbẹ naa ti wọn fi n ko owo jọ, eyi towo inu rẹ bayii jẹ miliọnu lọna mẹtadinlaadọjọ naira. Oríṣun àwòrán, @feminist_co Bakan naa ni ẹgbẹ Feminist Coalition tun rawọ ẹbẹ sawọn ọdọ pe ki wọn dẹkun iwọde naa, niwọn igba ti aarẹ ti ba araalu sọrọ, ti ko si mẹnuba ohunkohun to nii se pẹlu ibọn yinyin to waye ni Lekki. O ni dipo bẹẹ, se ni aarẹ Buhari se atilẹyin fun ikede konile o gbele to wa lawọn ipinlẹ kan lorilẹede yii, to si rọ awọn eeyan lati dẹkun iwọde fun aabo ẹmi wọn. Ko tan sibẹ, ẹgbẹ Feminisit Coalition tun pẹlu alaafia ni awọn oluwọde EndSARS fi n se iwọde wọn yika Naijiria, ti wọn si safihan iwa ọlọgbọn. Oríṣun àwòrán, @feminist_co ""Amọ nibi ti ọrọ de bayii, a gbọdọ daabo bo ẹmi ara wa ati tawọn ọmọ ẹgbẹ wa pẹlu."" Nipa ti owo ti wọn ri kojọ, tii se miliọnu lọna mẹtadinlaadọjọ naira fun iwọde naa, o ni awọn ti na miliọnu lsna ọgọta ninu rẹ laarin ssẹ meji, gẹgẹ bi alaye to wa lori ayelujara wọn. Oríṣun àwòrán, @VillaUpdates1 Atamatase ẹgbẹ agbabọọlu Super Eagles, John Ogu ti ke si awọn akẹgbẹ rẹ, lati maṣe kopa ninu ifẹsẹwọnsẹ Naijiria to n bọ lọjọ iwaju. O ni oun n pe ipe naa nitori iha ti ijọba apapọ kọ si iwọde End SARS. Agbabọọlu naa, to ti gba bọọlu fun Naijiria ni igba mẹrindinlọgbọn sọ pe, ṣiṣe bẹẹ yoo jẹ ki ijọba apapọ mọ bi ọrọ ṣe gbona si lara wọn. O ni kawọn oloselu kesi awọ̀n ọmọ wọn lati maa lọ soju Naijiria ninu ifẹsẹwọnsẹ Super Eagles to n bọ Kii ṣe Ogu nikan ni ọmọ Naijiria to jẹ agbabọọlu to bu ẹnu atẹ lu ọwọ ti ijọba fi mu iwọde naa, paapaa lẹyin ifẹmiṣofo to waye ni Lekki. Ṣaaju ni Odion Ighalo, to n gba bọọlu fun Manchester United nilẹ Gẹẹsi, ti kọkọ sọ pe ""itiju nla gbaa"" ni ijọba Naijiria jẹ lẹyin ikọlu Lekki. Ajọ ajafẹtọ ọmọniyan lagbaye, Amnesty International sọ pe ko din ni eeyan mejila to ku nibi iṣẹlẹ naa. Ṣugbọn ileeṣẹ ologun ti sẹ pe ohun ko mọ ohun nipa iṣẹlẹ to waye ni Lekki,  bẹẹ na ni ijọba ipinlẹ Eko naa ni oun ko mọ ohunkohun nipa rẹ, ti Aarẹ Muhammadu Buhari naa ko si sọrọ. Iwọde End SARS bẹrẹ lati pe fun opin si ẹka ileeṣẹ ọlọpa to n ri si iwa idigunjale, SARS, lori iwa aṣemaṣe ti wọn n wu ati bi wọn ṣe n tẹ oju ẹtọ awọn eeyan mọlẹ. #EndSARS : Àwọn ọ̀dọ́ dáná sun tírélà akẹ́rù tẹrùtẹrù ní Ekiti",23 Ọ̀wàrà 2020
"Àfikún owó epo, owó iná àti owó orí VAT ló jẹ́ ká fowó kún tàríìfù DSTV- Ọ̀gá MultiChoice"," Oríṣun àwòrán, Twitter/Super Sport Ti ko ba nidi, obinrin kii jẹ ikumolu. Ileeṣẹ MultiChoice Group to ni ileeṣẹ amohunmaworan DSTV ti ṣalaye fawọn ọmọ Naijiria ohun to ṣe okunfa bi wọn ti gbowo le tariifu ẹrọ amohunmaworan naa. Ileeṣẹ MultiChoice Group bi ijọba apapọ ti ṣe afikun owo ori VAT, epo rọbi  ati ina mọnamọna lo jẹ kawọn naa gbowo le DSTV. Oludari ileeṣẹ MultiChoice Group, John Ugbe lo sọrọ yii niwaju igbimọ ile aṣoju-ṣofin to ṣe iwadii afikun owo tariifu DSTV. O tun fesi lori bi awọn eeyan kan ti n sọ pe ileeṣẹ naa ko ṣe eto iranwọ fawọn ọmọ Naijiria lasiko coronavirus, MultiChoice Group ni ohun ti gbe biliọnu kan naira fun ijọba apapọ gẹgẹ bi owo iranwọ. Ileeṣẹ MultiChoice Group ṣalaye siwaju si pe bi ọrọ aje to dẹnu kọlẹ ṣe n ṣakoba fawọn ọmọ Naijiria lo n ṣe akoba fun ileeṣẹ ọhun naa. Lọjọ kẹtadinlogun oṣu kẹta 2020 yii ni ile igbimọ aṣoju-ṣoju gbe igbimọ kan kalẹ lati ṣe iwadii afikun owo tariifu DSTV ni Naijiria. coronavirus prevention badge update: Wo òótọ́ àti irọ́ tó wà nínú báàjì àyà náà Bakan naa ni ile tun pinnu lọjọ keji oṣu kẹfa pe ki ileeṣẹ DSTV wa wi tẹnu rẹ lori ọrọ tariifu naa. Ninu ọrọ rẹ, alaga igbimọ to n ṣe iwadii ileeṣẹ DSTV, Unyime Idem sọ pe ile bẹrẹ iwadii lẹyin tawọn ọmọ fi ẹhonu han lori afikun owo tariifu DSTV. Ile ti sun ijoko lori ọrọ naa siwaju lai lọjọ lẹyin ijoko ọjọ Aje. Abayọmi Aranmọlatẹ, Dr Laser: Vagino Plasty àti iṣẹ́ abẹ ẹwà Obìnrin ló jẹ mí lógún",13 Ọ̀wàrà 2020
Mo sì ń gba ìtọ́jú lọ́wọ́ lẹ́yìn tí Fury fẹ̀ṣẹ́ já iṣan ọwọ́ mi loṣù mẹ́jọ sẹ́yìn- Deontay Wilder," Oríṣun àwòrán, Reuters Iya ko to iya ni ọmọde maa sọ pe ko ni dara fun ẹni to lu oun. Agbaọjẹ abẹṣẹ ku bi ojo, Deontay Wilder lo sọ pe oun si n gba itọju lẹyin oṣu mẹjọ ti Tyson Fury ti fẹṣẹ dara si oun lara. Wilder oun ko lanfaani lati ṣe igbaradi kankan bayii nitori oun ni lati ṣe iṣẹ abẹ nitori ipalara ti oun ni lori iṣan ọwọ oun nigba ti o koju Fury. Wilder to jẹ abẹṣẹ ku bi ojo ọmọbibi ilẹ Amẹrika fidi rẹmi ninu ija fun igba akọkọ nigba ti oun ati Futy waako loṣu keji ọdun 2020 yii niluu Las Vegas l'Amẹrika. O yẹ kawọn mejeeji tun jọ koju ara wọn lẹẹkan si lọjọ kẹẹdọgbọn oṣu keje ṣugbọn iṣede ajakalẹ aarun coronavirus ko jẹ ki ija naa waye. ''Mo ti n gbadun bọ diẹ diẹ, ohun kan ti mo n ro lasiko yii ni lati gbadun pada,'' Wilder lo sọ bẹẹ. Wilder ti inagijẹ rẹ n jẹ Bronze Bomber sọ pe oun yoo bẹrẹ igbaradi kete ti oun ba ti gbadun tan. Nigba naa ni mo maa raye lati bẹrẹ si ni ṣe ohun ti mo fẹran lati maa ṣe. Oríṣun àwòrán, Getty Images Wilder ni oriṣiiriṣii ounjẹ loun n jẹ lọwọ yii pẹlu afẹsọna atawọn ọmọde to rọgba yi oun ka. O ni oun ko le ṣe aroye nipa ohun ti oun n la kọja lasiko yii, nitori gbogbo agbaye lo n la oriṣiiriṣii nkan kọja bayii fun igba akọkọ. Ṣugbọn Wilder si gbagbọ pe oun si le ba Fury ja ki ọdun 2020 to pari bo tilẹ jẹ pe ko tii gbadun ọwọ rẹ tan.",11 Ọ̀wàrà 2020
Olivier Giroud fi àràmọ̀ndà góòlù méjì ṣayẹyẹ ìfẹsẹ́wọnsẹ̀ ọgọ́rùn ún tó gbá fún France," Oríṣun àwòrán, Instagram/giroud918 Ọpọ olololufẹ ere boolu lo bu ẹnu ẹtẹ lu ẹlẹsẹ ayo, Olivier Giroud lẹyin to kuna lati gba goolu kankan sawọn fun ẹgbẹ agbabọọlu orilẹede Faranse ninu idije ife ẹyẹ agbaye lọdun 2018. Ṣugbọn Giroud ya agbado ha si awọn to maa n tako o lẹnu lalẹ Ọjọru nigba to gba goolu aramọnda meji ọtọtọ sawọn ninu ifẹsẹwọnsẹ ọlọrẹsọọrẹ to waye laarin ilẹ Faranse ati Ukraine. Ọjọ manigbagbe ni alẹ Ọjọru ọjọ keje oṣu kẹwaa, ọdun 2020 jẹ fun Giroud nitori ifẹsẹwọnsẹ to fakọyọ ninu rẹ yii lọ jẹ ifẹsẹwọnsẹ ọgọrun un ti yoo kopa ninu rẹ fun ilu baba rẹ, Faranse. Alabami ni ilẹ Faranse lu Ukraine ninu ere bọọlu naa lẹyin ti wọn gba goolu meje ọtọtọ wọle ti Ukraine si rapala da ẹyọkan ṣoṣo pada. Amọ ara ọtọ ni goolu meji ti Giroud ẹni ọdun mẹtalelọgbọn gba wọle ninu rẹ jẹ. Giroud ko si lara awọn ẹlẹsẹ ayo meji akọkọ lẹgbẹ agbabọọlu Chelsea to ti gbabọọlu jẹun, bakan naa ọpọ ni ko nigbagbọ ninu rẹ nigba to fi wa pẹlu ẹgbẹ agbabọọlu Arsenal. Ṣugbọn ọrọ Giroud ti di okuta tawọn ọmọle kọ silẹ to ti wa di pataki igun ile bayii pẹlu ara to fi bọọlu da nigba ti orilẹede Faranse waako pẹlu Ukraine. Lapapọ, Giroud ti gba goolu mejilelogoji sawọn bayii fun orilẹede Faranse ninu ọgọrun un bọọlu to ti ṣoju ilẹ naa. Oun ni ẹleṣẹ ayo keji to gbabọọlu sawọn julọ fun orilẹede Faranse, agbaọjẹ agbabọọlu Arsenal tẹlẹ ri, Thierry Henry lo wa ni ipo kinni. Goolu mẹsan an ni Henry fi ju Giroud lọ eyi ti o si lanfaani lati ba a ati lati ju u lọ.",8 Ọ̀wàrà 2020
"Cavani dèrò Man United, Arsenal bínú ra Partey ní £45m, Walcott padà sí ẹsẹ àárọ̀"," Oríṣun àwòrán, Getty Images Ẹni to ba foju ana wo oku, ẹbọra ni yoo bọ oluwa rẹ laṣọ. Ẹgbẹ agbabọọlu Arsenal ya agbado ha sawọn ololufẹ ere bọọlu lẹnu lẹyin ti wọn ra agbabọọlu aaringbungbun Thomas Partey lati Atletico Madrid. Lọjọ karun un oṣu kẹwaa ọdun 2020 ti ọja kata-kara kasẹ nlẹ ni Arsenal ra Partey ni miliọnu marundinlaadọta owo pọun. Partey to jẹ ọmọ ọdun mẹtadinlọgbọn kopa ninu ifẹsẹwọnsẹ liigi La Liga marun din logoji, o si gba goolu mẹta sawọn fun Atletico ni saa bọọlu to lọ. Partey to jẹ ọmọbibi orilẹede Ghana gba ife ẹyẹ Europa League ati Super Cup ọdun 2018 pẹlu Atletico nigba to wa nibẹ. Ẹwẹ, agbabọọlu Arsenal, Lucas Torreira lo rọpo Partey ni Atletico Madrid lẹyin to darapọ mọ wọn fun ọdun kan. Torreira lanfaani lati pada si ẹgbẹ agbabọọlu Arsenal lẹyin ọdun kan. Edinson Cavani dero Manchester United  Oríṣun àwòrán, Getty Images Yoruba bọ, wọn ni bi a ko ba ri adan, a mọ fi obẹ ṣe ẹbọ. Bayii gan an ni ọrọ ṣe ri pẹlu ẹgbẹ agbabọọlu Manchester United ninu ọja kata-kara awọn agbabọọlu to kasẹ nlẹ lọjọ Aje ọjọ karun un oṣu kẹwaa ọdun 2020. Agbabọọlu Borusia Dortmund Jadon Sancho ni Man United kọkọ le lati ra ṣugbọ ko ri ra nitori owo gọbọi ni Dortmund gbe le lori. Eyi lo jẹ ki man U lọ fun ẹleṣẹ ayo ẹgbẹ agbabọọlu PSG tẹlẹ, Edinson Cavani, ẹni ọdun mẹtalelọgbọn. Ọta le lugba o din mẹwaa ẹgbẹrun owo pọun(£250,000) ni Cavani yoo maa gba ni Manchester United. Aṣọ gbajugbaja Nọmba 7 tawọn agbaọjẹ agbabọọlu to ti ṣoju Man United tẹlẹ ri ni Cavani yoo maa wọ. Theo Walcott pada si Southampton Oríṣun àwòrán, Getty Images Ẹlẹsẹ ayo Theo Walcott ti pada si ẹgbẹ agbabọọlu Southampton lati Everton fun ọdun kan. Walcott pada si Southampton lẹyin ọdun mẹẹdogun to fi ẹgbẹ agbabọọlu silẹ darapọ mọ Arsenal. Ọdun 2018 ni Walcott fi Arsenal silẹ lọ Everton lẹyin ti wọn ta  a ni ogun miliọnu pọun. Walcott ọmọ ọdun mọkanlelọgbọn ṣalaye pe awọn ẹgbẹ agbabọọlu mii fẹ ra oun amọ oun pinnu lati pada si ẹsẹ aarọ ni Southampton. Oríṣun àwòrán, Getty Images Lọdun 2005 ni Walcott bẹrẹ si ni ṣoju Southampton nigba to pe ọmọ ọdun mẹrindinlogun.",6 Ọ̀wàrà 2020
Ayé má níkà o! Tottenham ya aṣọ iyì mọ́ Manchester United lára nírọ̀lẹ́ ọ̀jọ́ ìsinmi," Oríṣun àwòrán, EPA Ọjọ buruku Eṣu gbomi mu lọjọ isinmi ọjọ kẹrin oṣu kẹwaa ọdun 2020 jẹ fun ẹgbẹ agbabọọlu Manchester United. Ijamba ṣe Man United nile wọn lẹyin ti Tottenham wọ wọn ni aṣọ ẹtẹ pẹlu ami ayo mẹfa si ẹyọkan. Egungun to kọkọ jo iran ni yoo wo gbẹyin ni Tottenham fi ṣe fún Man United lẹyin ti Bruno Fernandez gba goolu akọkọ ninu ifẹsẹwọnsẹ ọhun ṣawọn. Góòlu mẹfa ọtọtọ ni United fi gba pada lọwọ Tottenham. Eyi ni igba keji ti Man United yoo fidi rẹmi ni papa isere Old Trafford ni saa bọọlu tuntun yii. Crystal Palace lo kọkọ lu wọn lalubolẹ mọle tẹlẹ.",4 Ọ̀wàrà 2020
Dákúdájí Chelsea bínú já òrùlé Stamford Bridge lé Crystal Palace lórí," Oríṣun àwòrán, Getty Images Akọnimọọgba ẹgbẹ agbabọọlu Chelsea, Frank Lampard ti fi idunnu rẹ han pẹlu bi wọn ṣe na Crystal Palace lalubami pẹlu ami ayo mẹrin si odo. Lampard ni aṣeyọri awọn ko ṣẹyin agbabọọlu tuntun, Ben Chilwell ti wọn ra fun miliọnu marundinlaadọta pọun. Chilwell to jẹ ẹni ọdun mẹtalelogun lo gba bọọlu wọ inu awọn, nigba ti Zouma ṣe iranwọ fun goolu keji, Jorginho gba penariti wọ inu awọn ni igba kẹta ati ikẹrin. Amọ, Frank Lampard ti rọ awọn agbabọọlu rẹ lati farabalẹ nitori ere ṣẹṣẹ bẹrẹ ni. Laipẹ yii ni Liverpool lu Chelsea ni alubami, ko to di wi pe wọn gberasọ pada. Bakan naa naa ni Everton naa Brighton ni ami ayo mẹrin si meji , nibi ti Rodriguez ti gba ami ayo meji wọ ni awọn, ti CalverLewin ati Mina naa gba bọọlu wọ inu awọn.",3 Ọ̀wàrà 2020
"Nínú akànṣẹ́ mẹ́ta ọmọ Nàìjíríà tó dáńtọ́ lágbàáyé, Yorùbá méjì wà nínu wọn"," Oríṣun àwòrán, Instagram Bi ọmọ ẹni ba daa, ẹ jẹ ki a wi, kii se pe a kuku fẹ fi ṣe aya ni.  Awọn ọmọ Naijiria to n ṣe bẹbẹ lagbo eṣẹ kikan lagbaaye lo bi ọrọ yii. Mẹta ni wọn, awọn naa si ni, Anthony Joshua, Israel Adesanya ati Kamaru Usman. Lootọọ oke okun ni awọn mẹtẹẹta fi ṣe ibugbe, amọ ko si ẹni to gbagbe orilẹede Naijiria gẹgẹ bi orirun wọn, ninu awọn mẹtẹẹta. Ẹ jẹ ki a wo bẹbẹ tawọn ọmọluabi mẹtẹẹta ọmọ Naijiria yii ṣe lagbaaye: Israel Adesanya - Igba ogun lo ti figa gbaga, ti ko si fidi rẹ́mi ninu ikankan Oríṣun àwòrán, Getty Images Ko si ẹni to le kọ iyan Israel Adesanya kere lagbo ẹṣẹ kikan ti UFC, ti wọn tun maa n pe ni MMA. Ilu Auckland lorilẹede New Zealand lo fi ṣe ibugbe, amọ ilu Eko ni wọn bi Israel si lọjọ kejilelogun oṣu keje ọdun 1989. Igba ogun ni Adesanya ti fija pẹẹta pẹlu oriṣiiriṣii awọn alatako, ṣugbọn gbogbo wọn lo la lalubolẹ bi ilu bẹmbẹ. Koda, o tun ṣẹṣẹ fakọyọ ninu ija to ja kẹyin ni, nibi to ti ṣe Paulo Costa bi ọsẹ ti n ṣe oju, ninu ija to waye niluu Abu Dhabi lorilẹede UAE laarọ lọjọ Aiku. Yemen Water Child: Ọmọdé 44 ni Sọ́jà pa, tí 100 míì sì kú látọwọ́ ohun ìjà olóró Ipele keje ni wọn ṣẹṣẹ de nigba ti Israel ti lu Costa, ti ori rẹ si bẹjẹ eyi to mu ki alakoso ija gbọwọ rẹ soke pe, o ti jawe olubori. Lọwọ yii, Israel ni igbanu ''UFC Middleweight'' wa lọwọ rẹ lagbaaye. Kamaru Usman - Ninu ija mẹtadinlogun, o fidi rẹmi ninu ẹyọ kan Oríṣun àwòrán, Instagram/kamaru Usman Kamaru Usman naa, tii ṣe ọmọbibi orilẹede Naijiria, jẹ akọni abẹṣẹ ku bi ojo lagbo ija MMA. Orilẹede Amẹrika lo fi ṣe ibugbe, amọ ilu Auchi nipinlẹ Edo ni wọn ti bi Usman, lọjọ kọkanla oṣu karun un ọdun 1987. Igba mejidinlogun ni Usman ti ja, mẹtadinlogun lo ti jawe olubori, ti o si fidi rẹmi ninu ọkan ṣoṣo ninu wọn. SS3 ní mo wà báyìí, mo sì ti gba àmì ẹ̀yẹ̀ púpò nílé-lóko gẹ́gẹ́ bí onílù - Ayansike Ọjọ kejila oṣu keje ọdun 2020 ni ija to kopa ninu rẹ kẹyin waye, ninu eyi to ti lu Jorge Masvidal niluu Abu Dhabi. Usman ni igbanu ''UFC Welterweight'' wa lọwọ rẹ bayii. Oríṣun àwòrán, Instagram/anthonyjoshua Ti a ba n sọrọ awọn afi ẹṣẹ ku bi ojo lagbaaye, ọrọ ko tii tan ti a ko ba darukọ Anthony Oluwafemi Joshua. Niluu Watford lorilẹede England, ni wọn ti bi Joshua lọjọ kẹẹdogun oṣu kẹwaa ọdun 1989, amọ bi iṣu lo maa jẹ orilẹede Naijiria lẹnu. Koda, o ti figba kan gbe ilu Eko ri nigba to n dagba. Joshua ti gba oriṣiiriṣii ami ẹyẹ ninu ẹṣẹ kikan lagbaaye, to fi mọ ami ẹyẹ wura ninu idije ''Olympics'' ọdun 2012. Bolaji Faleke ni Olùkọ́ tó ń kọ́ wa ní àṣà oge ṣiṣe lórí BBC Yorùbá Joshua ti fẹṣẹ yanju awọn ilumọọka akanṣẹ bi Wladimir Klitschko, Charles Martin, Joseph Parker, Alexander Povetkin ati Andy Ruiz Jr. Igbanu mẹta lẹka ẹṣẹ kikan to lami laaka lo wa lo lọwọ AJ nikan. Oun ni igbanu IBF, IBO, WBA ati WBO ''heavyweight'' wa lọwọ rẹ bayii. Káre akọni ọmọ Yoruba! Israel Adesanya fi ẹ̀ṣẹ́ fọ́ Paulo Costa lójú 'Misita Alagidi, emi leleyi!' ni gbolohun ti Israel Adesanya fi da awọn alatako rẹ lohun lẹyin to da bantẹ iya fun Paulo Costa ninu ija wọn to waye ni  Dubai. Isọri keji ija naa ni Adesanyta ti rọjo ẹsẹ lu Costa ti adari ija naa si bọ si aarin wọn lati pari rẹ ni kiakia. Ni bayi, Adesanya ṣi ni o jẹ olubori Middle Weight Champion of the World. Loju opo Twitter awọn ọmọ Naijiria to fi mọ Minisita feto ọdọ ati idaraya Sunday Dare ti n ki ku orire ija naa Oríṣun àwòrán, Getty Images Ọjọ nii pẹ, ipade kii jian. Ọjọ Aiku tii ṣe ọjọ kẹtadinlọgbọn oṣu kẹsan an ọdun 2020 ni ajijakandi ọmọbibi orilẹede Naijiria to jẹ aṣaaju ninu ija UFC, Israel Adesanya to yoo koju Paulo Costa ọmọ ilẹ Brazil. Faabada! Ẹyin ologinni ko gbọdọ balẹ. Adesanya ko ti fidi rẹmi ri lati igba to ti di agbaọjẹ lagbo UFC. Ija MMA mọkandinlogun ni Adesanya ti kopa ninu rẹ ti o si jawe olubori ninu gbogbo wọn, nigba ti alako rẹ, Costa ko tii fidi rẹmi ninu ija MMA mẹtala to ti ja.  Ilu Abu Dhabi, United Arab Emirates lawọn mejeeji yoo ti waako lọjọ Aiku. Nigba ti wọn n tahun si ara ṣaaju ija ọjọ Aiku, Costa oun yoo gbe Israel tọrọ ba doju rẹ tan nitori ko lara. Amọ ile lo kuku ba Adesanya naa, oun naa sọ pe oorun ti ko si Costa loju ohun lo si n ṣakoba fun un. Adesanya ni ti oun ba le ki Costa lọrun mọlẹ pẹrẹ, o ni ọrun naa ko tun jẹ tirẹ mọ. Israel sọ pe o ṣe oun bi ki ija naa ti bẹrẹ nitori oun ko le duro mọ lati da ẹṣẹ bo Costa lori. Igba mẹrinla ni Adesanya ti lu alatako rẹ lalubami ti wọn maa n pe ni TKO ninu ija mọkandinlogun to ti ja. SS3 ní mo wà báyìí, mo sì ti gba àmì ẹ̀yẹ̀ púpò nílé-lóko gẹ́gẹ́ bí onílù - Ayansike",26 Owewe 2020
"Alámì ẹ̀yẹ Scrabble Paul Sodje àti ọ̀rẹ́ rẹ́ kú lásìkò tó fẹ́ lọ́ sanwó ìdóòlà ẹ̀mí àbúrò rẹ̀, tí afurasí darandaran jí gbé"," Oríṣun àwòrán, Others Adari ikọ ere idaraya Scrabble ni Naijiria tẹlẹri, Paul Sodje ti ku lẹyin ti awọn afurasi darandaran ji gbe. Agbẹnusọ fun ẹgbẹ Nigerian Scrabble Federation, Akintunde Akinsemola, to fi idi iṣẹlẹ naa mulẹ fun BBC Yoruba ni, wọn ri oku rẹ ni agbegbe Idoani ni ijọba ibilẹ Ọṣẹ nipinlẹ Ondo. Akinṣemọla ni ọjọru to jẹ Ọjọ Kẹsan, Oṣu Kẹsan, ọdun 2020 ni o yẹ ki Paul Sodje pe ẹni ọdun marundinlọgọta. Awọn ikọ Nigerian Scrabble Federation naa pejọ pọ lati ranti ọ̀jọ ibi rẹ lori ẹrọ ayelujara ni ọjọ naa. Paul Sodje lo dari ikọ Naijiria lọ si idije Alawọ dudu ilẹ Afrika to waye ni orilẹede Zambia ni ọdun 2012. Nigba to n salaye bi iṣẹlẹ naa ṣe bẹrẹ ni bi ọsẹ meji sẹyin,  Akinsemola ni lasiko ti wọn fẹ lọ sin mọlẹbi rẹ to ku ni ipinlẹ Delta, ni wahala naa bẹrẹ. Mayowa Omoniyi: Kò sí orin Obey, Sunny Ade abí tàkasúfèé tí ń kò le ta gìtá sí '' Ibi isinku mọlẹbi rẹ, ni wọn wa ti wọn ti gba ipe wi pe Chris, tii se aburo Paul Sodje, wa ni panpẹ awọn ajinigbe, ti wọn si ni ki wọn mu ọgọrun miliọnu wa lati tu silẹ.'' ''Awọn ẹbi ati iyawo Chris Sodje bẹ awọn agbebọn naa lati jọwọ gba miliọnu kan Naira, ti awọn ni agbara lati san.'' ''Alami ẹyẹ Scrabble ni Naijiria naa wa gbera pẹlu ọrẹ rẹ, lati lọ san owo ẹmi ti awọn ajinigbe naa beere fun ni agbegbe ti wọn ti ji gbe.'' Alaga ẹgbẹ Nigerian Scrabble Federation ni, lati igba ti wọn ti lọ san owo ẹmi naa ni wọn ko ti gburo Paul Sodje, Chris Sodje ati ọrẹ rẹ to tẹle Paul, lati lọ san owo fun awọn ajinigbe naa. Baby abandoned on dunmpsite: Mo ti bímọ mẹ́rin tẹ́lẹ̀ fún bàbá méjì nínú òṣí- Dupe Ogbomos Akinsemola ni titi di asiko yii, ko si ẹni to le e sọ pato ohun to ṣẹlẹ laarin awọn ajinigbe naa ati awọn ti wọn lọ san owo naa. O fikun pe, ni ọjọ diẹ lẹyin iṣẹlẹ yii ni awọn darandaran naa tun ṣẹ ikọlu si Idoani, nibi ti wọn ti gbe Adari ileewosan ijọba nibẹ pẹlu awọn eniyan miran lagbegbe naa. ''Lasiko ti wọn n wa awọn eniyan ti awọn darandaran naa jigbe lọ si ileewosan to wa ni ilu Ọwọ, ni wọn ri oku Paul Sodje ati ọrẹ rẹ ni ile igbokusi to wa ni Ọwọ.'' Awọn adari ni ilu Idoani ti Otunba Oladele Olapeju ṣe adari fun ni, wọn ri oku Paul Sodje ati ọrẹ rẹ ni ilu Ajagbale, ti ko jina si ilu Ifọn.'' Oríṣun àwòrán, Others ''Awọn lo gbe e oku rẹ lọ si ileewosan ijọba apapọ to wa ni ilu ọwọ titi di asiko yii.'' Nibayii, inu ibanujẹ ni ẹbi ati ara Paul Sodje wa lọwọlọwọ, paapaa iyawo Chris Sodje, Flora, ti ko tilẹ mọ boya ọkọ rẹ wa laye abi o ti ku. Flora, lasiko to n ba BBC Yoruba sọrọ ni oun ti sa gbogbo ipa oun lati wa ibi ti ọkọ rẹ wa, ti o si fi to gbogbo awọn ẹsọ alaabo to wa ni Naijiria leti. O ni lati igba ti wọn ti lọ fun awọn ajinigbe naa ni owo, ni awọn darandaran naa ti kọ lati ba awọn sọrọ mọ, ti awọn ko si gburo Chris Sodje to jẹ ẹni ọdun mọkanlelogoji titi di asiko yii. Gbogbo igbiyanju BBC Yoruba lati ba ileeṣẹ ọlọpaa ni ipinlẹ Ondo sọrọ lori isẹlẹ yii, si lo ja si pabo.",10 Owewe 2020
Mo ṣetán láti fi ẹ̀ṣẹ́ dín dòdò ìyà fún Anthony Joshua- Efe Ajagba," Oríṣun àwòrán, Instagram Yoruba bọ, wọn ni o di oni karangida, adiẹ n jẹ ifun ara wọn. Bayii lọrọ ri abẹṣẹ ku bi ojo ọmọ Naijiria, Efe Ajagba to ni oun ṣetan lati fi ẹṣẹ din dodo iya fun ogbontarigi akẹṣẹ Anthony Joshua. Ilẹ Amẹrika ni Ajagba to ti ṣoju orilẹede Naijiria ri ninu idije ''Olympics'' fi ṣe ibugbe bayii lẹyin to ti wa niluu Eko fun ọpọlọpọ ọdun. Ọrọ naa da bi ẹni to maa ku pade ẹni to maa pa, nirori Joshua gan an funra rẹ ti sọ tẹlẹ pe o wu oun lati fija pẹta pẹlu akẹṣẹ to jẹ ọmọbibi ilẹ Afirika bi t'oun naa. Ajagba tiẹ ti bẹrẹ si ni sọ ọna ti o fi le fẹyin AJ gbalẹ ti wọn ba koju ara wọn. Ajagba sọ fawọn akọroyin pe ko ba wu oun ki Joshua gba lati ba oun ja lorilẹede Naijiria tawọn mejeeji ti wa. Abẹsẹ ku bi ojo ọmọ Naijiria ṣalaye pe lootọọ ni pe Joshua lagbara, amọ ọgban inu loun maa fi ṣẹ AJ leegun ẹyin tawọn koju ara awọn. O ni ati oun ati Joshua lawọn jọ lagbara ṣugbọn o ni ọgbọn ju ọgbọn lọ. Ajagba ni otitọ ni pe Joshua ti gba ami ẹyẹ goolu ninu idije ''Olympics'' ri, oun si tun ni abẹṣẹ ku bi ojo to lami lahaka taye ti aye  n fẹ lọwọ bayii. Oun oun naa gboṣuba fun AJ fun awọn aṣeyọri rẹ lagbo ẹṣẹ kikan, amọ oun mọ awọn ibi ti Joshua ku si ninu ẹṣẹ kikan. Joshua gba awọn igbanu rẹ mẹtẹẹta, IBF, WBA ati WBO pada lọwọ Andy Ruiz Jr pada lẹyin ti Ruiz ti kọkọ lu u bi aṣọ ofi nigba ti wọn kọkọ koju ara wọn. Joshua naa fẹ ṣe bi agbọjẹ ninu ẹṣẹ kikan, oloogbe Muhammad Ali to ba George Foreman ja ni Zaire lọdun 1974. Amọ Ajagba ti kepe Joshua pe ko jẹ ki awọn ṣe ere ọwọ papọ ni Naijiria, o ni ti o ba ti ya eegun Joshua, o ti ya ọlọrẹ t'oun naa.",3 Owewe 2020
